,Comment,Likes,Time,user,UserLink
0,Congrats to Zion on being officially the third owner of the Phoenix Suns organization. I’m sure Giannis and Luka are more than happy to have him in the ownership group.,1.3K,8 hours ago,,
1,"Zion scored 70 points on the same team, in one weekend. That's crazy!!",1K,9 hours ago,,
2,"I’m glad us impatient fans didn’t get to decide when Zion came back from injury. It’s clear he took the time necessary to come back 100%, if not 110%. Looks better than ever!",846,9 hours ago,,
3,"From a person that lived in New Orleans for most of his life ,I can confirm that this is the most talented & the most loaded roster we've ever had in New Orleans Basketball History! The Baron Davis & CP3 eras can't compare but to watch this franchise come from all of that til what is today ,this is beautiful",204,7 hours ago,,
4,"As a lifelong Pelicans fan since yesterday, I'm glad my team is finally playing well.",532,8 hours ago,,
5,It is honestly so hard to dislike this Pels team. So much working for them. Zion and Jose are such great stories for this season. Love to see them doing well.,65,6 hours ago,,
6,"Zion is such a force to be reckoned with. You know EXACTLY what he's gonna do, but you CAN'T stop it!",64,5 hours ago,,
7,This is a rivalry! I am happy for CJ for finding a home in New Orleans. Great win!,154,9 hours ago,,
8,Oh nothing to see here everyone.....Zion just being unstoppable and scoring 35 points.........AGAIN!!!!!!,156,9 hours ago,,
9,"Zions ball handling , quickness and overall game has improved so much this year it’s literally crazy how good he is",13,3 hours ago,,
10,Another amazing game by the Pels. Zion should be in the MVP race.,663,9 hours ago,,
11,Zion just doing what he was doing before the injury. Love to see it.,238,9 hours ago,,
12,Pelicans vs Suns has been so fun to watch between the playoffs and now pelicans taking two huge wins over them when everyone thought the suns would be better. Shoutout Zion he’s been an mvp caliber player especially with his team in first in the western conference.,168,9 hours ago,,
13,Zion is like the eye of the storm in that game. Truly a beast inside the court. This pelicans team is so fun to watch.,16,7 hours ago,,
14,Zion going to his left is practically unstoppable,31,7 hours ago,,
15,Pelicans feels like they found their style. Zion is just unstoppable force,91,9 hours ago,,
16,Great win Pelicans let's keep it going,25,9 hours ago,,
17,I find it very refreshing the way Zion plays. Nobody can guard that dude man.,14,6 hours ago,,
18,That end of the game 360 put Zion on total domination level,16,6 hours ago,,
19,Great WIN by the Pelicans again! This game was very physical and competitive. I am extremely proud of this team and how far they've become. CONGRATS to ZION for his game-high record and dominating performance!!!,5,4 hours ago (edited),,
20,Starting to love this Rivalry out of the West,78,9 hours ago,,
21,Love how zion is playing this year & hopefully he can stay %  for the rest of the year,20,8 hours ago,,
22,CJ was feeling himself after dunkhe seemed in a good mood after that..from all that love his team gave um.Well deserved. That’s my dude!!!,32,9 hours ago (edited),,
23,Zion putting great numbers this season. Pels deserve to be top in the west.,78,9 hours ago,,
24,Zion moves like a video game character....dude one of a kind... got me crying the whole game...,6,4 hours ago,,
25,Zion has officially entered the MVP conversation!!!,10,7 hours ago,,
26,love the badblood between this two teams. I hope they meet in the playoffs with healthy lineup,7,6 hours ago,,
27,Zions energy is contagious,5,3 hours ago,,
28,"It's hard to beat, intelligent power and grace. The brother got the package guided by Willie Green from the D,as in Detroit. A coach that wait for his turn and now shocking the NBA with this leadership skill. For sure the team to watch. And seems  like the players love playing for him. You can see and feel the love they have for each other",7,7 hours ago,,
29,"Hope Zion can stay healthy so that he can also showcase this dominance if they make it to the playoffs, BI and CJ too. Making this a formidable thresome plus those pesky of the bench players.",5,7 hours ago,,
30,Man I'm so happy for Zion! As a big guy myself who struggles everyday with my poor eating habits I know how hard it is to stay disciplined. Keep up the good work Zion!,3,3 hours ago,,
31,Suns players made sure they were by the basket at the end,19,8 hours ago,,
32,"GOD DAMN, I can’t wait until Ingram is healthy and at full force. This team is going to be insane during playoff time.",10,7 hours ago,,
33,One thing that continues to amaze me about Zion is his efficiency,0,17 minutes ago,,
34,The pelicans are crazy they got good chemistry and the unselfishness by the pelicans if they keep on doing this they will go a really long way,1,1 hour ago,,
35,So happy the Pelicans beat the Suns again Go Pelicans can’t wait for BI to come back,5,4 hours ago,,
36,Pelicans going to the Championship and WIN IT!!!!!!!!,65,9 hours ago (edited),,
37,So great to see how pelicans playing well this season.,1,8 hours ago,,
38,Wow.Zion is a MONSTER when penetrating to the rim.Unstoppable,2,8 hours ago,,
39,8:12 man what strength by Zion,4,5 hours ago,,
40,"""U can understand it or not""  Pelicans are here to stay",14,9 hours ago,,
41,Such an amazing transformation. How the Pelicans have blossomed ever since getting rid of Anthony Davis.,1,3 hours ago,,
42,This Pels team could win it all. They’re very good and they play well as a unit. They have a ton of heart and play hard for a full 48 mins.,5,6 hours ago,,
43,The crowd at the end wanted him to disrespect the Suns so bad,9,9 hours ago,,
44,It's so awesome to have witnessed the pelicans evolve into a top teir contender just so awesome,15,8 hours ago,,
45,The suns have so many dads it’s insane,89,9 hours ago (edited),,
46,Pels are for real....beatinng a quality team without BI twice back to back,38,9 hours ago,,
47,If Zion just stays healthy he’ll be great this season,1,6 hours ago,,
48,"I love the voice of the NO Pelicans announcer, almost as much as the great Kevin Calabro. He's got a nice gravely tone. Pelicans/Suns is my favorite rivalry thus far this season.",4,8 hours ago (edited),,
49,Zion and the pelicans are on fire,4,9 hours ago,,
50,Zion and CJ at the top of the key both playing pg is fun to watch and tough to beat,2,2 hours ago,,
51,Zion is officially “him” he’s that guy,59,9 hours ago,,
52,It’s always good to get an OT win during the season to get some experience for later on .,3,6 hours ago,,
53,Dude went running at the end of the game ready to dunk it again   Zion started a trend,1,2 hours ago,,
54,Pelicans going CRAZY! And BOOKER IS NO WHERE TO BE FOUND 🫣,11,9 hours ago (edited),,
55,"Man,Willie Green is doing a great job with the team. When Pels took him as coach,i thought hed be another Steve Nash. Didnt expect Pels to be 1st in the standing at any point. And now,here we are.",1,8 hours ago,,
56,"Can’t wait to see Zion, Ingram and Cj in the playoffs. Speaking it into existence",0,1 hour ago,,
57,Zion SONNING the Suns yet again!!!,3,7 hours ago,,
58,Satisfied to see Suns getting cocky early in the game and screwing things in crunch time,8,8 hours ago,,
59,"Just imagine everybody healthy , I can’t imagine anybody stopping us",4,8 hours ago,,
60,I remember when Zion was in high school so many people said he wouldn’t do the same in the NBA lmao,9,8 hours ago,,
61,Let's go Pelicans! This is the new team rivalry matchup!,1,7 hours ago,,
62,Zion doing co- parenting with Luka,107,9 hours ago,,
63,The electricity in the building and the whole league in on FIIRRRRREEE because of this team right now. LETS GET IT!!,10,9 hours ago,,
64,Okay Folks...Zion WIlliamson has arrived and is looking like a man among boys...unstoppable!!! Another 4-5 games like this and he catapults himself into the top spot for MVP his team is winning!!! Big ups to CJ he is the steady hand... BI isn't even playing,5,8 hours ago,,
65,Goodness man Zion is so talented and strong.,0,4 hours ago,,
66,Zion “Freight Train” Williamson.  He reminded me of a Young Lebron charging to the basket!,3,8 hours ago,,
67,"Zion, Luka, Giannis. These monstrous players really love dominating the Suns.",1,6 hours ago,,
68,"Zion for mvp , nd he can really shoot if he wants , Zion is simply unstoppable!",99,9 hours ago,,
69,"So happy CJ has someone to throw alleyoops to!! Wished for years the blazers would get him someone with leaps like Zion. Happy for you CJ, but still sad to see you leave Portland. I knew you would make the Pelicans great!!",2,4 hours ago,,
70,Going to be a wild playoff series if they end up meeting this post season....,0,2 hours ago,,https://www.youtube.com/channel/UCWxFUGPw5fwz-rgGVagSI0g
71,Pelicans only going to get better. Just have to stay healthy,19,9 hours ago,,
72,CJ McCollum had his best game since returning from injury.,17,9 hours ago,,
73,Good game to the pels from a suns fan.  They are looking scary this year. Close game,2,6 hours ago,,
74,I’m so happy for New Orleans Pelicans! -htx,0,4 hours ago,,
75,I guess i can take my foot out of my mouth...bc i was the one saying Cj and Zion and other players wouldn't play well together. Great Job Pels!! Beat my Suns back to back!!,3,8 hours ago,,
76,Zion was the real deal. He’s godly good…,2,3 hours ago,,
77,Zion MVP. It’s happening this year.,21,9 hours ago,,
78,CJ & Ingram perfect pieces to go along with Zion they going to be GREAT,22,9 hours ago,,
79,"It's been amazing it would have been amazing if Zion hit that buzzer beater!!! Go set ,suns!!",1,8 hours ago,,
80,Pelicans owns phoenix this year,6,9 hours ago,,
81,When Zion develops a jumper it's gonna be very scary.,10,8 hours ago,,
82,Too strong For them Mount Zion,1,6 hours ago,,
83,Everyone who is a fan of the nba wants these two play each other round 1 or two of the playoffs,0,2 hours ago,,
84,I hope we get this playoff series this year,1,8 hours ago,,
85,suns defended that last posession reallly well,46,9 hours ago,,
86,Pelicans are so serious this season mane,13,9 hours ago,,
87,Man the playoffs are taking too long ...I can't wait to see this match up I want 7,1,5 hours ago,,
88,BACK TO BACK GAMES...ayyy Pels still UP TOP,9,9 hours ago,,
89,The pels are nice man even without BG they caught a perfect amount of everything vet experience in CJ young talent Zion nance and BG and also solid roll players as well,1,5 hours ago,,
90,Zion just doing some Barkley stuff out there. Bully basketball with finesse and just demolishes anyone on his path. Not sure why he's not in the MVP race but his last 7-10 games has been to say the least superb!,1,5 hours ago,,
91,Never seen a coach so hype for a win lol they wanted this one!,14,9 hours ago,,
92,I look at the pelicans and feel like a proud dad.,1,7 hours ago,,https://www.youtube.com/channel/UCBpBsUhZ_5ZfRYa-D4pdvqg
93,Gotta love those wins against Phoenix,0,1 hour ago,,
94,It's always a good day when Luka's sons lose. Even though his main son did not play.,17,9 hours ago,,
95,Ain’t no way they beating everyone with 2 starters missing and their X-Factor Jose GTA!,11,9 hours ago,,
96,Pelicans are scary they doing this without Ingram and herb Jones as well,6,8 hours ago,,
97,Zion was hooping like he was playing some Drew League dudes His game is so effortless at times.,0,2 hours ago,,
98,Zion an absolute tank,1,6 hours ago,,
99,"3:41 freeze... that's the look of someone who has officially chosen to fully embrace their skills and their capacity to dominate. I don't know what Zion's been eating or reading or watching or whatever but he turned a corner recently and I'm pretty sure he isn't looking back. I rescind what I was saying about being a Relative Potential Bust. Hope he doesn't get any injuries, though. Man just ONE season with no serious injuries across the league would be great.",1,6 hours ago,,
100,Now this is gonna be a great rivalry,0,4 hours ago,,
101,The crowd to Chris Paul love this rivalry,0,8 hours ago,,
102,Suns started hot and fuse out like always we need to make some moves,6,9 hours ago,,
103,Ya era necesario un jugador franquicia para un equipo emergente como los Pelicans y no siempre los mismos como Lakers o Celtics...,0,4 hours ago,,
104,A healthy Zion makes the basketball world a better place.,0,2 hours ago,,
105,0:48 the power of Zion,0,5 hours ago,,
106,AD and Zion on pelicans could've been a crazy duo,2,8 hours ago,,
107,"Please stay healthy Zion, let's see some more of these ridiculous buckets.",0,4 hours ago,,
108,Bruh that tying bucket from CP to send it to Ot was beyond a travel,15,9 hours ago,,
109,"Zion shooting threes ain’t new, but it hasn’t gotten any less scarier.",1,6 hours ago,,
110,"Was really hoping to see another highlight dunk at the end, just to rub it in.",0,4 hours ago,,
111,Zion for MVP race,0,6 hours ago,,
112,"Zion is on a mission this season, even their best/primary defender “Miles Bridges” couldn’t contain him for two game straight. He will eat the suns in the playoffs, mark my words.",1,3 hours ago (edited),,
113,It’s gone be a league wide DNA test to see who’s the father of the suns,2,8 hours ago,,
114,Pelicans owns the suns,11,9 hours ago,,
115,You got to love the coach having the same attitude of his players.,1,7 hours ago,,
116,Young Boy been proving his self pretty good for a prep school kid,0,7 hours ago,,
117,"Zion Williamson 70 points same team this weekend, Pelicans most dangerous team in the West playoffs if all stay healthy",2,7 hours ago,,
118,Zion made their Zone defense look like wing zone chicken lol,1,5 hours ago,,
119,"@4:21 as a blazers fan, that made me happy. CJ deserves to ball out",0,7 hours ago,,
120,Why is the suns losing so satisfying,14,9 hours ago,,
121,"They don’t even got BI out there, geez this team is actually nuts",1,5 hours ago,,
122,We needed another 360 hahah the pelican looking very good this year,1,8 hours ago,,
123,"Zion is like a tank from left 4 dead, you just have to get out of his way fr",0,5 hours ago,,
124,imagine if PELs have taken that last shot,1,9 hours ago,,
125,Legend in the making Zion the future,0,32 minutes ago,,
126,damn Luka and Zion fighting over custody for their kid Devin.,13,9 hours ago,,
127,Might be the best rivalry the NBA got going deez day's,1,9 hours ago,,
128,As a non pelicans fan. I’ve never seen a player that bullies grown men like Zion.,0,3 hours ago,,
129,Let's go pelicans️️,0,1 hour ago,,
130,regular season matters to suns haters when they lose. Doesn't matter at all when they win. I'm fine with a loss like this if it allows Ayton and Mikal to work on their games.,2,8 hours ago,,
131,Let's geaux pels!Z for MVP!,4,9 hours ago,,
132,"Zion healthy and Ingram coming back,,",6,9 hours ago,,
133,Zion for mvp step-dad of the year,5,9 hours ago,,
134,A lot of empty seats on such a good game,1,5 hours ago,,
135,Commentator said it's not necessary to see windmill on final seconds.. For me. Yahh it's necessary Do it again zion!  I'll be happy to see suns reaction again,1,2 hours ago,,
136,Zion trying to play defense cracks me up.,0,33 minutes ago,,
137,I would’ve pulled that 3 at the end ngl,4,9 hours ago,,
138,"You could see this coming since last year's playoffs, the Pels didn't win 2 games without Zion for no reason.",3,9 hours ago,,
139,Thanks for beating the Luns once again.I love it.,0,9 hours ago,,
140,Go Pelicans Great Win.,0,3 hours ago,,
141,that midrange shot by zion was so tuff,0,8 hours ago,,
142,"Sheesh! Zion looked motivated! Lefty post turn around fader, woooo!",0,8 hours ago,,https://www.youtube.com/channel/UCOaJrsD00NAs-tBDAvHe8Og
143,Fireworks if these guys meet in the playoffs,0,9 hours ago,,
144,Zion acting like he got something to prove,7,9 hours ago,,
145,Suns a very good team and if Pelicans beating and destroying them like this only means Pelicans no joke really serious and a super threat period to the Western conference,1,2 hours ago,,
146,Pels will be for sure a first-rounder in the playoffs.,1,5 hours ago,,
147,CJ putting on a clinic. I miss him on the blazers,0,3 hours ago,,
148,"The Suns played well, I still like them Suns and the Pelicans are worthy adversary's wanting to get their licks in because of the heart breaking loss against them in 2021..",1,4 hours ago,,
149,Imagine if Zion did an exhibition dunk before the buzzer?,0,8 hours ago,,
150,Got Larry looking like Clippers Griffin of Blake,6,9 hours ago,,
151,"Zion is just getting started.  He’s Shaq with a handle, jumper, free throw and 3.",0,4 hours ago,,
152,I love that 2nd commentator's enthusiasm,1,9 hours ago,,
153,Zion is making nba dude play high low out of anger. He is what league needs,0,7 hours ago,,
154,if these guys plays like these every game championship is waving,0,8 hours ago,,
155,Go Pelican  Pelican Win Baby !!!! In God Name blessed me on this Day !!!!,1,8 hours ago,,
156,"Waiting for BI and Herb to play. Pels have a decent group of Wings (Trey 6'10 Herb 6'7 BI 6'9 Zion 6'7 and the big rookie point guard Dyson Daniels 6'7) Love the way pels build a roster around BI and Zion. Instead of picking up a great shooter for spacing, they surround those two wit  3&D players and great wing players. JV, Willie the Euroleague MVP, Larry Nance(Small ball 5) and Hayes in middle. At the guards are CJ, Jose, Dyson, graham, Lewis and Neji Marshall a Swiss Army knife type of playa. Kudos to David Griffin. Btw Trey really been looking alot like BI",1,4 hours ago (edited),,
157,This is real nba basketball. In my head this is what the Shaq era lakers looked like vs the jazz for example.,0,2 hours ago,,
158,Came for Booker & Zion...might need to cop this NBA pass..#Celtics4Ever,2,9 hours ago,,
159,I was waiting for another windmill dunk at the end,0,6 hours ago,,
160,Zion has only played 103 games... That's barely 1 season ... This dude is going to be CRAZY in 4 years,0,3 hours ago,,
161,Pels Gone Be Dangerous in That West Conference..(if healthy).   Zion is a Beast..,0,8 hours ago,,
162,"ayton reminds me so much of the mail man, he needs a young PG to be able to RUN with him on the break the way malone/stockton did. Its that one element missing from his game, but its the transition 3 era so w.e",0,2 hours ago (edited),,
163,"We need Ingram there, deadly team.",1,6 hours ago,,
164,"The only sad thing about this night is that it's gonna take a while for CP3 to feel any love from the city that ""Raised him""....",0,1 hour ago,,
165,Pels defense is nuts,0,7 hours ago,,
166,"You know that's gotta sting the suns, losing to the pels like that twice in a row",0,7 hours ago,,
167,if luka wins mvp and the pels win the championship 2k simulation is never wrong,3,6 hours ago (edited),,
168,The fact that Booker sat out for this game says a lot about his mentality.,0,4 hours ago,,
169,Always entertaining when the Suns go home with an L,1,8 hours ago,,
170,Imagine the pelicans had Ingram,0,32 minutes ago,,
171,Larry Nancr Jr. catching bodiesUnderrated,1,6 hours ago,,
172,Damn pelicans are going to be scary w Brandon Ingram,1,7 hours ago,,
173,Mavs the suns daddy but the pels are they step daddy,6,9 hours ago,,
174,just back to back games for Zion taking his Phoenix Sons to school,1,7 hours ago,,
175,Willie Green head to head with Mike Brown and Joe Mazzulla for Coach of the Year conversation,1,8 hours ago,,
176,"Very good performance zion,,",2,9 hours ago,,
177,Love the Pelicans announcers,0,1 hour ago,,
178,C.J. is so smooth he looks like he's doing ballet out there,0,2 hours ago,,
179,"My uncle just said if Zion and Bradley beal was on the same team, that would be the new Shaq & Kobe.. lowkey, that would be SCARY AF!",5,9 hours ago,,
180,7:44 Bridges mood lmao,2,8 hours ago,,
181,"I know the commentator meant it as sarcasm when he said ""Chris Paul, he creates contact by his own. Smart player...going to the hall of fame..""",0,7 hours ago,,
182,I love seeing CJ shine.,1,9 hours ago,,
183,#SunsFan. This is going to be an entertaining Playoff rematch. See you there.,0,1 hour ago,,
184,Biggest rivalry right now,1,9 hours ago,,
185,Damn I was nervous watching these highlights,4,9 hours ago,,
186,"Congrats to the Pels! Keep playing as a ""team"" & this year might be your time. Improve your 3pt shootings, you will need it along the way.",1,7 hours ago,,
187,Willie Green coach of the year hands down,0,7 hours ago,,
188,My guy Zion be beasting grown ass men moving like big momma like his feet always hurt but he got hella springs doe I don't get it  then u watch him walk like he hurt but catching body's wtf,0,37 minutes ago,,
189,This team is loaded mind you they did it without Ingram if he comes back this is done. Felt sorry for the suns 2x in a row that dunk really made them mad.,0,4 hours ago (edited),,
190,Love the home crowd,1,8 hours ago,,
191,Booker got so punked last game he got too scared to show up today,5,9 hours ago,,
192,CP0 and the suns are the first team in history to have two biological fathers… Luka and Zion,1,5 hours ago,,
193,Of course Booker sat out. Ducking the smoke lmao,1,8 hours ago,,
194,WHAT A GAME!!,0,8 hours ago,,
195,New rivalry in NBA. This is fun.,0,9 hours ago,,
196,Zion starting to look like the pheonix suns' step dad. LMAO,0,2 hours ago,,
197,The New Orleans Pelicans are 18-8️️,5,9 hours ago,,
198,BEST RECORD IN FRANCHISE HISTORY (26 GAMES),0,8 hours ago,,
199,Okay now we need a Luka Vs. Zion Matchup. Winner gets custody of the Suns because it aint fair that Phoenix got two daddies lol.,4,8 hours ago,,
200,I am not scared of putting my bet on my Pels. The Suns are only tough when they are...,17,10 hours ago,,
201,The suns actually had 2 men in defence in the last 3 seconds..,1,7 hours ago,,
202,Suns would of been first round exits if zion playsd last tear,6,10 hours ago,,
203,Sending the Suns back to Phoenix with two L’s,0,5 hours ago,,
204,We own the suns!!!,6,10 hours ago,,
205,Zion and Luka now deciding to share custody of the Suns organization I'm glad they could work things out between each other and handle this in a mature way instead of being petty like parents normally do,0,8 hours ago,,
206,"damnn both mavs and pels fans  are enjoying this so much
listen up everyone  The Phoenix Son's!!!",0,8 hours ago,,
207,Zion smokin that Suns pack,0,6 hours ago,,
208,"I dont even think Zion is at his peak performance, maybe 10 - 15 pounds less bodyfat and more muscle and this dude will be a monster",0,3 hours ago,,
209,Zion William's just casually shoves that guy to the floor trying to pass the ball,1,9 hours ago,,
210,YEA WILLIE! TALK YO TALK BOY!,3,9 hours ago,,
211,love Zion but you have to finish with you right sometimes. teams will adjust to it after enough games,0,7 hours ago,,
212,Should have shoot the ball in that last second wanna see more of those snow flakes suns,0,9 hours ago,,
213,OH MY GOD……..They can prolly do it ….if Brandon comes back too?!??… they might be them ..and I’m betting on Memphis,0,58 minutes ago,,
214,"Pelicans you all should be ashame,showing out like dat, two consecutive nights. Great game & great team chemistry!!!!",0,8 hours ago,,
215,Zion is beast man ..,0,2 hours ago,,
216,Finally the Nba has a new Conference rivalry,8,9 hours ago,,
217,hope they done another 360 dunk,0,9 hours ago,,
218,Dem Pels on Fiya,0,8 hours ago,,
219,The pels standing on business,2,10 hours ago,,
220,"Thanks, Portland, for sending us Larry Nance!!",0,6 hours ago,,
221,8:14 that’s bully ball at its finest. Jerome bettis out there,1,8 hours ago,,
222,They sent the Suns to the 4th seed in two days,4,8 hours ago,,
223,"Look at Luka Doncic's and Zion Williamson's team. Give No. 11 a break, he also got posterized at the 1st game",1,8 hours ago (edited),,
224,Every team tries their  hardest against the lakers️Say I ain't so...,1,6 hours ago,,
225,"Unlike the Saints, Pels are looking GOOD!",1,9 hours ago,,
226,Would love to see warriors vs pelicans,0,7 hours ago,,
227,Zion just warming up...,0,9 hours ago,,
228,Pelicans NBA finals contenders?,4,10 hours ago,,
229,Pels looking like a contender,0,32 minutes ago,,
230,Zion just needs that mid range jumper,0,8 hours ago,,
231,Emotional damage to the sun ️,1,8 hours ago,,
232,Zion should have dunked that ball again at the end,0,5 hours ago,,
233,dude told me yesterday suns gonna rip us apart i replied he never hit me back lmao..dont sleep on the Pels also they were missing booker & we been missing BI so,2,9 hours ago (edited),,
234,Book was very missed. They still took it to OT without him.,8,9 hours ago,,
235,"Would it be fire, if he dunk it again, in the last possesion",0,8 hours ago,,
236,bruh CJ is officially EATING now that zion is back... glad to see! Pels are a MUST WATCH team!!!,0,5 hours ago,,
237,ZION...WILLIAMSON... aka...MONSTARS !!!,0,2 hours ago,,
238,zion destroyed bridges. just goes to show that u really need a different kind of defender for people like zion. hes just too powerful.,0,8 hours ago,,
239,Zion WilliamSUNS!,0,3 hours ago,,
240,Bruh they scary and BI is not playing yet. But im worried zion would be the one inside so BI should start shooting threes,3,9 hours ago,,
241,Zion Williamson full tank build is activated!,0,8 hours ago,,
242,CJ's game is so nice.,0,2 hours ago,,
243,Zion going crazy,0,8 hours ago,,
244,I really like this pelicans team,0,7 hours ago,,
245,Zion on different level,1,9 hours ago,,
246,Hearing Chris Paul getting booed by a New Orleans crowd is SO beautiful,5,8 hours ago,,
247,"GREAT FRICKIN WIN PELICANS,WHODAT",0,6 hours ago,,
248,Zion be like these guys are my Suns,1,5 hours ago,,
249,Chris Paul traveled on the drive to the basket at 8:26 w/ :05 seconds left. Missed call!,0,4 hours ago,,https://www.youtube.com/channel/UCFc5_ZeNg_iOEns07H8ztsg
250,the announcer was funny asf,0,7 hours ago,,
251,1:15 Z floated,1,8 hours ago,,
