,Comment,Likes,Time,user,UserLink
252,ZION SHOUKD BE IN MVP CONSERVATION BULLIED SUNS AGAIN35 pts 7 reb 4 ast 13-1735 pts 8 reb 4 ast 14-21Back to back games vs suns,3,9 hours ago,,
253,Suns got humbled,0,1 hour ago,,
254,"It's official...CP3 is changing sports. Speed walking just like the State Farm ""race walking"" AD",1,9 hours ago,,
255,Lezzgow!,2,9 hours ago,,
256,This pelican team is stacked they’re a legit contender,0,9 hours ago,,
257,Zion :“Zion Score”  “Zion Dunk”,0,4 hours ago,,
258,Pelicans own the suns,3,10 hours ago,,
259,"announcer: ""see that ball movement...how it goes from hand to hand....but it all starts with cp3""me: well yeah hes the point guard...",0,5 hours ago,,
260,Man it’s so good to see my pelicans doing well. Best part about it is that this is without BI,0,9 hours ago,,
261,Bro @8 min was that not the most obvious travel ever ?,0,8 hours ago,,
262,Zion is in the mvp conversation,0,9 hours ago,,
263,Go Pels!,0,9 hours ago,,
264,Bruh and this isn't even the Pels final form! #GG #GeauxPels #WontBowDown,3,10 hours ago,,
265,I knew zion was gonna cook when i saw em walking back to the locker room at halftime,1,4 hours ago,,
266,why didn’t they show zion’s 3 pointers?,0,44 minutes ago,,
267,I'm still trying to figure out how them Pelicans beat them Sun's twice in 2 days,0,6 hours ago,,
268,So I saw bridges shooting at the pelicans with hand  signs during the game and in OT he run out of bullet and Zion was just ready and wide awake when to use his bullets so he used them in OT to shoot the suns. It's not to get their fast its to know how to get there fast..,0,3 hours ago,,
269,Zion and CJ a nasty combo,0,9 hours ago,,
270,Phoenix suns softest team in nba,3,10 hours ago,,
271,Play some Damn Defense Suns!!,0,9 hours ago,,
272,Wish they would of tried to score at the very end again.,0,3 minutes ago,,
273,Chris Paul getting straight boos in Nola  kinda crazy,0,4 hours ago,,
274,zion should be in mvp convos now and willie for coach of the year. pels have a big 3 and its scary. I really hope they go far with this team,0,8 hours ago (edited),,
275,Damn Zion disrespected them last matchup and beat them again,0,9 hours ago,,
276,"DeAndre Ayton played well today:28pts (13-18 FGM, 2-3 FTM)12 Rebs5 Asts1 Block1 TO",4,9 hours ago,,
277,"Yo fkn KNEW IT!!!I CALLED IT IN OFFSEASON!!!I SAID THE PELS GON BE A PROBLEM!! WITH THE ADDITION OF THE VET CJ!! KNEW THIS WAS COMING.. NOW LOOK..1ST IN THE WEST!!This ain’t even my Team…But the past 2 seasons…They became my adopted team!!!  I really like this team, players, & their chemistry!!!
GO NO!!.. NO ON GO!!",1,9 hours ago (edited),,
278,I love that the commentator is just calling CP3 on all of his bullshit,1,2 hours ago,,
279,Just when I was thinking…Zion kinda quiet this season bro…ZION GOES OFF-,0,9 hours ago,,
280,Chris Paul traveled when he took that shot with 3 seconds left,0,5 hours ago,,
281,Zion is the new owner of Suns,0,1 hour ago,,
282,The difference in the game was the points in the paint. New Orleans outscored Phoenix in the paint 70-64. That was the difference in the game.,3,9 hours ago,,
283,Zion please stay healthy,0,7 hours ago,,
284,Owls look great when BI comes back it’s gonna be a serious problem,0,6 hours ago,,
285,Big W #Pelicans,0,8 hours ago,,
286,The Suns battled at the end of regulation and in the OT but Zion Williamson continue to dominateand CJ McCollum came up huge today as the Pelicans climbed to the No.1 in the Western Conference.,0,9 hours ago,,
287,Imagine when BI is playing too…,1,4 hours ago,,
288,i wish zion dunk it again,0,7 hours ago,,
289,Bridges celebrating all those shots way to early in the 1st quarter look at them now,0,7 hours ago,,
290,"Man i wish zion stays healthy, dude is a menace.",0,2 hours ago,,
291,Its time for the Suns to rebuild their whole franchise,0,7 hours ago,,
292,Suns have found their kryptonite,0,6 hours ago,,
293,Love it!,0,8 hours ago,,
294,If ballerinas became body builders zion is probably what that would look like. Strong and nimble.,0,8 hours ago,,
295,"I don't know if any will agree with me, in Zion reminding me of a bigger version of Derrick Rose?!",0,2 hours ago,,
296,Pelicans got to be one of the most hyped crowds ever currently Pels in 5,0,8 hours ago,,
297,They didn't show nun of Zions 3's he made 2 of them (NOT JUST A DUNKER),2,7 hours ago,,
298,if zion gets even a decent midrang then bro gonna be evil on the court,0,7 hours ago,,
299,Zion really good but i see hes still dont have that ability to take over in clutch minutes. Glad CJ with them.,0,8 hours ago,,
300,They should have tried shooting the 3 ball in the end of the 4q.,0,8 hours ago,,
301,Larry makes every team better...,1,9 hours ago,,
302,Zion for MVP,2,10 hours ago,,
303,Pain looks like he didn't take his mask off for Halloween,0,9 hours ago,,
304,Zion for MVP! NO ONE CAN GUARD HIM! My god. This is for the haters! Show them!!,0,9 hours ago,,
305,Zion for MVP,0,7 hours ago,,
306,So Luka and Zion are now the co-owners of the Phoenix Sons. Lol,0,7 hours ago,,
307,Solid pelicans,0,8 hours ago,,
308,It's sad the Suns just have no bite within them.  Imagine them squaring up vs Celtics or Bucks in 7 game series,0,5 hours ago,,
309,NOP with No B.I scary as hell hope they can maintain til' playoffs new era is coming.,1,6 hours ago,,
310,Zion must be the MVP race if not the ownership group of the Suns,0,5 hours ago,,
311,Zion did his usual but CJ closed tht thang out,0,5 hours ago,,
312,zion really fucking up a 7ft,1,8 hours ago,,
313,CJ was ballin,0,3 hours ago,,
314,Zion said imma pick up where I left off,1,3 hours ago,,
315,why would you cut Zion making a 3 pointer @2:33?,2,4 hours ago,,
316,"a sotto ""attack"" @ 6:31... I like this announcer",0,6 hours ago (edited),,
317,Why do they have games against each other again in just 2 days? A surprise to me but glad to see Zion wins agin.,0,8 hours ago,,
318,They are looking scary game after game as long as they can stay healthy this young team gonna be hard to beat. That boy Zion is back congratulations willie green I love to see black coaches get their dues,1,6 hours ago,,
319,Pelicans might be a problem!,1,9 hours ago,,
320,Zion needs to get most improved player,0,9 hours ago,,
321,"zion is bulldozing suns defense, but he always goes left and becomes predictable it may become a problem come playoff time. but will enjoy it for now.",1,9 hours ago,,
322,Suns 4 game losing streak,2,10 hours ago,,
323,"SUNS, ya’ll slipped in the 3rd and OT. If you’re having problem bring in some Golds.",0,5 hours ago,,
324,They made luka mad they lossTheyade zionad they lossSuns gotta stop acting tough,1,1 hour ago,,
325,Zion is the best young player for sure,1,9 hours ago,,
326,Zion should dunk it 360°at the final seconds as a show of respect to the fans,0,9 hours ago,,
327,What a game!this is nba!.!!,0,6 hours ago,,
328,Zion needs to start working on that jump  shot. They were building a wall. Yes he still can't be stopped but that will go south once playoffs come.,0,5 hours ago,,
329,It’s time to put Zion Top 10,0,8 hours ago,,
330,Fans really fat-shamed Zion to the 1st seed.,1,9 hours ago,,
331,If Zion stays healthy for a couple of seasons he will win the MVP. His team is number 1 in the west so to me he should be second to Tatum cause Boston is first in the east or Giannis with the bucks at second,0,6 hours ago,,
332,Remember when he was bullying kids in high school and everyone was like “he ain’t gonna do that in the league”. . Good call,0,3 hours ago,,
333,Can't wait to see Ye rocking a Zion jersey,0,8 hours ago,,
334,Phoenix son's of Zion,2,6 hours ago,,
335,CJ Zion Ingram can easily get to a WCF if all healthy in sync that's 25 25 30 pts a game,2,10 hours ago,,
336,If ONLY SUNS GET KAI SOTTO IN THEIR LINEUP THEY WILL BEAT PELICANS FOR SURE..,0,5 hours ago,,
337,I love it when they boo CP3,0,7 hours ago,,
338,"Zion forgets but never forgives until you remind him what happened last year so he wants to smoke them everytime he play them and he did it again , Zion will do anything to eliminate the suns in the playoffs , this boy is on a mission...",0,3 hours ago,,
339,pels going hard rn,0,2 hours ago,,
340,I’m afraid Zion won’t stay healthy.  I love watching him but he puts so much strain on his legs,0,9 hours ago,,
341,Zion is a big big big problem! If he can master a nice mid range jumper there would be nothing you could do with him.,0,4 hours ago,,
342,Zion moves bodies.,0,4 hours ago,,
343,Good game by the short handed suns. Glad to see Ayton & Bridges playing great.,1,9 hours ago,,
344,Pelican crazy dangerous this season. Ingram is not even playing.,0,7 hours ago,,
345,This is beautiful,0,9 hours ago,,
346,This is all with their second best player BI.,0,9 hours ago,,
347,What an unlikely rivalry.,0,8 hours ago,,
348,NBA need to get the 720p it’s annoying not seeing a good clear game of highlights,1,9 hours ago,,
349,The Suns tend to fold under pressure,0,6 hours ago,,
350,Pelicans are stacked. Deepest bench in the league.,0,8 hours ago,,
351,Zion Williamson:35pts8 Rebs3 Asts1 Steal,1,10 hours ago,,
352,you've nvr seen a guy that big go     anywhere         anytime.,0,9 hours ago,,
353,"Shame he didn't dunk it again, I would have been a Zion fan for the next 10 years.",0,9 hours ago,,
354,Yea the pels are nice w it,0,9 hours ago,,
355,Damn Z is so smooth,0,7 hours ago,,
356,imagine if AD never leaved this team with AD will be the best team on the league,0,9 hours ago,,
357,to think the suns were a Finals caliber team.,0,8 hours ago,,
358,They for REAL Man... New Orleans is a good team,0,10 hours ago (edited),,
359,Zion vs Giannis and Zion vs Simmons will be very physical,1,1 hour ago,,
360,Pelicans would’ve beaten them last year if Zion was playing easily,1,2 hours ago,,
361,Here fa Zion and  CJ,1,7 hours ago (edited),,
362,"So glad seeing Mikal Bridges being humbled, and the whole Zion Suns team.",0,6 hours ago,,
363,Don’t tell me Chris Paul will be mad again?,0,8 hours ago,,
364,Why is the game faster than regular speed?,0,8 hours ago,,
365,"Several thoughts1.  Landale played 20 minutes and Biyombo did not even play.  Is Landale that much better than Biyombo?2.  Image how good the the Pelicans when Brandon Ingram comes back.  However can Zion stay healthy?3.  The way the Phoenix suns, even with the injury of Booker, they will not do well in the playoffs.",0,8 hours ago,,
366,They booed CP3 after all the things he did for New Orleans ? Very classy,0,5 hours ago,,
367,Its crazy to think McCollum might win a chip before Lillard.,0,9 hours ago,,
368,Should have 360'd again at the end there.,1,8 hours ago,,
369,i am so bummed as a blazer fan watching CJ and Larry Navy JR ball the fuck out,1,9 hours ago,,
370,I was waiting for another 360 Windmill,0,6 hours ago,,
371,GET OWNED SUNS!!!!,0,8 hours ago,,
372,It should not have been an overtime. Look at CP3's foot. He stepped too many times then shot the ball. How is that not a travel?,1,7 hours ago (edited),,
373,Zion is the suns DADDY,1,10 hours ago,,
374,Pelicans needs another solid backup point guard. Rose is available they can get him. If they want to go below they get IT  for free and try him for 10 day contract.,0,6 hours ago (edited),,
375,"Even without booker, they went to overtime. This would be a 15 point win with booker in",0,5 hours ago (edited),,
376,Its like the suns play older brother and feels so disgusted being out played by younger brother. Not once buy twice. Lol,0,9 hours ago,,
377,"Too strong for a wing to guard him, and too quick for a big to guard him. How do you guard Zion?",1,9 hours ago,,
378,Lol Devin Booker was too scared to show up,0,10 hours ago,,
